from,legacyTitle
/accessibilite/contact-accessibilite,Contact accessibilité
/accueil-se-former-tnd,Se former aux TND
/accueil-se-former-tnd/annuaire-formations-tsa-tnd,Annuaire de formations au TSA au sein des TND
/accueil-se-former-tnd/campus-gncra,Le Campus du GNCRA
/accueil-se-former-tnd/cnia,Certificat national d'intervention en autisme (CNIA)
/accueil-se-former-tnd/etp-autisme,Éducation thérapeutique du patient adaptée au trouble du spectre de l'autisme
/accueil-se-former-tnd/formations-des-cra,Formations dispensées par les CRA
/accueil-se-former-tnd/formations-du-gncra,Formations dispensées par le GNCRA
/accueil/centre-ressources-autisme-cra,Qu'est-ce qu'un centre de ressources autisme (CRA)
/accueil/charte-graphique-filiere-tdah,Charte graphique filière TND TDAH
/accueil/chef-projet-documentaire,Chef de projet diffusion des connaissances et ingénierie documentaire
/accueil/contact-pros-cra,Formulaire de contact pour les professionnels des CRA
/accueil/espace-presse,Espace presse
/accueil/gncra,Groupement national des centres ressources autisme (GNCRA)
/accueil/gncra/charte-graphique-filiere-tsa,Charte graphique filière TSA (trouble du spectre de l'autisme)
/accueil/incollables-autisme,Les Incollables de l'autisme
/accueil/stagiaire-qualite,Stagiaire qualité
/aides-autisme,Guide des aides pour les personnes autistes et leurs proches
/annuaire-ressources-autisme,Annuaire de ressources pour l'autisme
/evenements-maison-de-l-autisme,Événements et actualités à la Maison de l'autisme
/evenements-maison-de-l-autisme/exposition-art-specifique-interets-d-autistes,"Exposition ""Art spécifique, Intérêts d'autistes"""
/evenements-maison-de-l-autisme/invitation-differente-film,Différente : invitation gratuite
/evenements-maison-de-l-autisme/journee-mondiale-autisme,Journée mondiale de l'autisme
/evenements-maison-de-l-autisme/reperage-precoce-des-ecarts-de-developpement,"Campagne ""Agir Tôt"" pour le repérage précoce des écarts de développement"
/evenements-maison-de-l-autisme/veille-presse-troubles-du-neurodeveloppement,Veille presse troubles du neurodéveloppement
/fiches-pratiques-autisme,Fiches pratiques sur l'autisme et ses troubles associés
/fiches-pratiques-autisme/acteurs-et-organismes-autisme,Acteurs et organismes dans l'autisme
/fiches-pratiques-autisme/autisme-et-tdah,Autisme et TDAH : quand les troubles coexistent
/fiches-pratiques-autisme/carnet-de-sante-reperage-tnd,Carnet de santé avec repérage précoce des TND
/fiches-pratiques-autisme/college-autisme-tnd,"Aller au collège quand on est un jeune avec autisme, TDAH, troubles dys, Tourette..."
/fiches-pratiques-autisme/communication-autisme,Méthodes pédagogiques et communicationnelles dans l'autisme
/fiches-pratiques-autisme/dispositif-scolarisation-tnd,"Dispositifs de scolarisation (Ulis, UEMA, UEEA, autorégulation, EMS) pour les enfants avec un TND"
/fiches-pratiques-autisme/dossier-mdph-autisme,Dossier MDPH en cas de trouble du neurodéveloppement
/fiches-pratiques-autisme/douleur-personne-autiste-tnd,"Douleur chez la personne autiste (Repérer, comprendre et accompagner)"
/fiches-pratiques-autisme/droits-aidants-autisme,Droits des aidants dans l'autisme
/fiches-pratiques-autisme/etudier-autisme,Accéder aux études supérieures quand on est une personne autiste ou avec TND
/fiches-pratiques-autisme/harcelement-scolaire-chez-les-eleves-avec-un-tnd,Harcèlement scolaire chez les élèves avec un TND
/fiches-pratiques-autisme/loisirs-autisme,Avoir des loisirs quand on est une personne autiste
/fiches-pratiques-autisme/lycee-autisme-tnd,"Aller au lycée quand on est un jeune avec autisme, TDAH, troubles dys, Tourette..."
/fiches-pratiques-autisme/methodes-interventions-autisme,Méthodes d'interventions recommandées dans l'autisme
/fiches-pratiques-autisme/parcours-diagnostic-autisme,Parcours de diagnostic d'autisme
/fiches-pratiques-autisme/particularites-alimentaires-autisme,Particularités alimentaires chez les personnes avec autisme
/fiches-pratiques-autisme/particularites-communication-autisme,Particularités de communication dans l'autisme
/fiches-pratiques-autisme/pco-autisme,Plateforme de coordination et d’orientation (PCO) dans les TND
/fiches-pratiques-autisme/proche-aidant-personne-autiste,Proche aidant de personne autiste
/fiches-pratiques-autisme/protection-personne-autiste,Être protégé quand on est une personne autiste
/fiches-pratiques-autisme/qu-est-ce-que-l-autisme,Qu'est-ce que l'autisme ?
/fiches-pratiques-autisme/rbpp-tnd,RBPP dans les TND (troubles du neurodéveloppement)
/fiches-pratiques-autisme/relations-sociales-autisme,Avoir une vie relationnelle quand on est une personne autiste
/fiches-pratiques-autisme/reperage-precoce-tnd-enfant,Repérage précoce des TND chez l'enfant
/fiches-pratiques-autisme/scolarisation-enfant-autiste,"Dispositifs d'appui à la scolarité de mon enfant autiste, TDAH, dys, TDI, Tourette"
/fiches-pratiques-autisme/se-deplacer-quand-on-est-autiste,Se déplacer quand on est une personne autiste
/fiches-pratiques-autisme/se-former-proche-aidant-autisme,Se former quand on est aidant
/fiches-pratiques-autisme/se-loger-quand-on-est-autiste,Se loger quand on est une personne autiste
/fiches-pratiques-autisme/se-soigner-quand-on-est-autiste,Se soigner quand on est une personne autiste
/fiches-pratiques-autisme/soutien-repit-proches-aidants-autisme,Soutien et répit des proches aidants de personnes autistes
/fiches-pratiques-autisme/suivi-gynecologique-femme-autiste,Suivi gynécologique d'une femme autiste
/fiches-pratiques-autisme/travailler-quand-on-est-autiste,Travailler quand on est une personne autiste - aides et droits
/fiches-pratiques-autisme/travailler-quand-on-est-autiste-integration,Travailler quand on est une personne autiste - pour une bonne intégration en entreprise
/fiches-pratiques-autisme/travailler-quand-on-est-autiste-maintien-evolution,Travailler quand on est une personne autiste - maintien en emploi et évolution professionnelle
/fiches-pratiques-autisme/travailler-quand-on-est-autiste-ressources-employeurs,Travailler quand on est une personne autiste - ressources pour les employeurs
/fiches-pratiques-autisme/troubles-dys,Troubles dys au sein des TND
/fiches-pratiques-autisme/troubles-neurodeveloppement,Troubles du neurodéveloppement (TND)
/fiches-pratiques-autisme/vacances-autisme,Partir en vacances quand on est une personne autiste
/fiches-pratiques-autisme/vacances-enfant-autiste,Préparer les vacances avec mon enfant autiste
/glossaire-autisme,Glossaire des termes utilisés dans l'autisme
/guide-parcours-diagnostic-autisme,Guide des parcours de diagnostic d'autisme
/politique-de-confidentialite,Politique de confidentialité de la Maison numérique de l’autisme
/presentation-maison-de-l-autisme,Qu'est-ce que la Maison de l'autisme ?
